{
  "contractVersion": "0.1.0",
  "project": { "id": "prj_urban", "workspaceId": "ws_demo", "title": "凌晨来电", "ownerUserId": "usr_owner", "aspectRatio": "16:9", "narrativeMode": "dialogue", "dataRegion": "CN", "createdAt": "2026-09-21T01:00:00Z" },
  "source": { "chapterId": "chp_urban", "title": "第一章", "activeSourceVersionId": "srcv_u1", "versions": [{ "id": "srcv_u1", "ordinal": 1, "createdAt": "2026-09-21T01:00:00Z", "createdBy": "usr_owner", "characterCount": 16, "fragments": [{ "id": "frag_u1", "ordinal": 1, "startOffset": 0, "endOffset": 16, "text": "林岚接起电话，听见母亲急促的呼吸。", "contentHash": "sha256-urban" }] }] },
  "adaptationPlan": { "id": "plan_u1", "targetDurationSeconds": 180, "status": "confirmed", "episodes": [{ "id": "ep_u1", "ordinal": 1, "title": "来电", "sourceFragmentIds": ["frag_u1"], "coreEventFactIds": ["fact_u1"] }] },
  "stageResults": [
    { "stage": "storyKnowledge", "activeVersionId": "cv_uk1", "confirmedVersionId": "cv_uk1", "versions": [{ "id": "cv_uk1", "ordinal": 1, "status": "confirmed", "parentVersionId": null, "createdAt": "2026-09-21T01:01:00Z", "createdBy": "usr_owner", "creationMethod": "ai", "confirmedBy": "usr_owner", "confirmedAt": "2026-09-21T01:02:00Z", "items": [{ "id": "fact_u1", "kind": "storyFact", "ordinal": 1, "label": "母亲来电", "content": { "factType": "event" }, "provenance": [{ "type": "source_fragment", "sourceVersionId": "srcv_u1", "fragmentId": "frag_u1", "transformation": "retained" }], "locked": false }] }] },
    { "stage": "script", "activeVersionId": "cv_us1", "confirmedVersionId": null, "versions": [{ "id": "cv_us1", "ordinal": 1, "status": "candidate", "parentVersionId": null, "createdAt": "2026-09-21T01:03:00Z", "createdBy": "usr_owner", "creationMethod": "ai", "items": [{ "id": "se_u1", "kind": "scriptElement", "ordinal": 1, "label": "接听", "content": { "elementType": "action" }, "provenance": [{ "type": "source_fragment", "sourceVersionId": "srcv_u1", "fragmentId": "frag_u1", "transformation": "actionized" }], "locked": false }] }] },
    { "stage": "settings", "activeVersionId": "cv_ut1", "confirmedVersionId": null, "versions": [{ "id": "cv_ut1", "ordinal": 1, "status": "candidate", "parentVersionId": null, "createdAt": "2026-09-21T01:04:00Z", "createdBy": "usr_owner", "creationMethod": "ai", "items": [{ "id": "asset_u1", "kind": "settingAsset", "ordinal": 1, "label": "手机", "content": { "assetType": "prop" }, "provenance": [{ "type": "source_fragment", "sourceVersionId": "srcv_u1", "fragmentId": "frag_u1", "transformation": "retained" }], "locked": false }] }] },
    { "stage": "storyboard", "activeVersionId": "cv_ub1", "confirmedVersionId": null, "versions": [{ "id": "cv_ub1", "ordinal": 1, "status": "candidate", "parentVersionId": null, "createdAt": "2026-09-21T01:05:00Z", "createdBy": "usr_owner", "creationMethod": "ai", "items": [{ "id": "shot_u1", "kind": "shot", "ordinal": 1, "label": "电话近景", "content": { "durationSeconds": 4 }, "provenance": [{ "type": "source_fragment", "sourceVersionId": "srcv_u1", "fragmentId": "frag_u1", "transformation": "visualized" }], "locked": false }] }] }
  ],
  "adaptationAdditions": [], "impactLinks": [], "suggestions": [],
  "aiJobs": [{ "id": "job_u1", "stage": "script", "status": "partially_succeeded", "scopeKeys": ["scene:1", "scene:2"], "estimatedCredits": 3, "settledCredits": 1.4 }],
  "exportMetadata": { "generatedAt": "2026-09-21T01:06:00Z", "confirmationScope": "includes_candidates", "formats": ["json"] }
}
