{
  "contractVersion": "0.1.0",
  "project": { "id": "prj_fantasy", "workspaceId": "ws_demo", "title": "灵脉初醒", "ownerUserId": "usr_owner", "aspectRatio": "9:16", "narrativeMode": "narration", "dataRegion": "CN", "createdAt": "2026-09-21T00:00:00Z" },
  "source": { "chapterId": "chp_fantasy", "title": "第一章", "activeSourceVersionId": "srcv_f1", "versions": [{ "id": "srcv_f1", "ordinal": 1, "createdAt": "2026-09-21T00:00:00Z", "createdBy": "usr_owner", "characterCount": 18, "fragments": [{ "id": "frag_f1", "ordinal": 1, "startOffset": 0, "endOffset": 18, "text": "少年在祠堂醒来，掌心浮现青色灵纹。", "contentHash": "sha256-fantasy" }] }] },
  "adaptationPlan": { "id": "plan_f1", "targetDurationSeconds": 60, "status": "confirmed", "episodes": [{ "id": "ep_f1", "ordinal": 1, "title": "灵纹", "sourceFragmentIds": ["frag_f1"], "coreEventFactIds": ["fact_f1"] }] },
  "stageResults": [
    { "stage": "storyKnowledge", "activeVersionId": "cv_fk1", "confirmedVersionId": "cv_fk1", "versions": [{ "id": "cv_fk1", "ordinal": 1, "status": "confirmed", "parentVersionId": null, "createdAt": "2026-09-21T00:01:00Z", "createdBy": "usr_owner", "creationMethod": "ai", "confirmedBy": "usr_owner", "confirmedAt": "2026-09-21T00:02:00Z", "items": [{ "id": "fact_f1", "kind": "storyFact", "ordinal": 1, "label": "灵纹觉醒", "content": { "factType": "event" }, "provenance": [{ "type": "source_fragment", "sourceVersionId": "srcv_f1", "fragmentId": "frag_f1", "transformation": "retained" }], "locked": false }] }] },
    { "stage": "script", "activeVersionId": "cv_fs1", "confirmedVersionId": "cv_fs1", "versions": [{ "id": "cv_fs1", "ordinal": 1, "status": "confirmed", "parentVersionId": null, "createdAt": "2026-09-21T00:03:00Z", "createdBy": "usr_owner", "creationMethod": "ai", "confirmedBy": "usr_owner", "confirmedAt": "2026-09-21T00:04:00Z", "items": [{ "id": "se_f1", "kind": "scriptElement", "ordinal": 1, "label": "掌心特写", "content": { "elementType": "action", "text": "青色灵纹亮起" }, "provenance": [{ "type": "source_fragment", "sourceVersionId": "srcv_f1", "fragmentId": "frag_f1", "transformation": "visualized" }], "locked": false }] }] },
    { "stage": "settings", "activeVersionId": "cv_ft1", "confirmedVersionId": "cv_ft1", "versions": [{ "id": "cv_ft1", "ordinal": 1, "status": "confirmed", "parentVersionId": null, "createdAt": "2026-09-21T00:05:00Z", "createdBy": "usr_owner", "creationMethod": "ai", "confirmedBy": "usr_owner", "confirmedAt": "2026-09-21T00:06:00Z", "items": [{ "id": "asset_f1", "kind": "settingAsset", "ordinal": 1, "label": "青色灵纹", "content": { "assetType": "prop", "color": "cyan" }, "provenance": [{ "type": "source_fragment", "sourceVersionId": "srcv_f1", "fragmentId": "frag_f1", "transformation": "visualized" }], "locked": true, "lockedBy": "usr_owner", "lockedAt": "2026-09-21T00:06:00Z" }] }] },
    { "stage": "storyboard", "activeVersionId": "cv_fb1", "confirmedVersionId": null, "versions": [{ "id": "cv_fb1", "ordinal": 1, "status": "candidate", "parentVersionId": null, "createdAt": "2026-09-21T00:07:00Z", "createdBy": "usr_owner", "creationMethod": "ai", "items": [{ "id": "shot_f1", "kind": "shot", "ordinal": 1, "label": "灵纹特写", "content": { "durationSeconds": 3 }, "provenance": [{ "type": "source_fragment", "sourceVersionId": "srcv_f1", "fragmentId": "frag_f1", "transformation": "visualized" }], "locked": false }] }] }
  ],
  "adaptationAdditions": [], "impactLinks": [], "suggestions": [],
  "aiJobs": [{ "id": "job_f1", "stage": "storyboard", "status": "succeeded", "scopeKeys": ["shot:1"], "estimatedCredits": 2, "settledCredits": 1.8 }],
  "exportMetadata": { "generatedAt": "2026-09-21T00:08:00Z", "confirmationScope": "confirmed_only", "formats": ["json", "docx", "xlsx"] }
}
