{
  "contractVersion": "0.1.0",
  "project": { "id": "prj_suspense", "workspaceId": "ws_demo", "title": "雨夜门铃", "ownerUserId": "usr_owner", "aspectRatio": "9:16", "narrativeMode": "dialogue", "dataRegion": "CN", "createdAt": "2026-09-21T02:00:00Z" },
  "source": { "chapterId": "chp_suspense", "title": "第一章", "activeSourceVersionId": "srcv_s1", "versions": [{ "id": "srcv_s1", "ordinal": 1, "createdAt": "2026-09-21T02:00:00Z", "createdBy": "usr_owner", "characterCount": 15, "fragments": [{ "id": "frag_s1", "ordinal": 1, "startOffset": 0, "endOffset": 15, "text": "门铃响了三次，监控画面里却没有人。", "contentHash": "sha256-suspense" }] }] },
  "adaptationPlan": { "id": "plan_s1", "targetDurationSeconds": 60, "status": "confirmed", "episodes": [{ "id": "ep_s1", "ordinal": 1, "title": "空门", "sourceFragmentIds": ["frag_s1"], "coreEventFactIds": ["fact_s1"] }] },
  "stageResults": [
    { "stage": "storyKnowledge", "activeVersionId": "cv_sk1", "confirmedVersionId": "cv_sk1", "versions": [{ "id": "cv_sk1", "ordinal": 1, "status": "confirmed", "parentVersionId": null, "createdAt": "2026-09-21T02:01:00Z", "createdBy": "usr_owner", "creationMethod": "ai", "confirmedBy": "usr_owner", "confirmedAt": "2026-09-21T02:02:00Z", "items": [{ "id": "fact_s1", "kind": "storyFact", "ordinal": 1, "label": "无人门铃", "content": { "factType": "event" }, "provenance": [{ "type": "source_fragment", "sourceVersionId": "srcv_s1", "fragmentId": "frag_s1", "transformation": "retained" }], "locked": false }] }] },
    { "stage": "script", "activeVersionId": "cv_ss1", "confirmedVersionId": "cv_ss1", "versions": [{ "id": "cv_ss1", "ordinal": 1, "status": "confirmed", "parentVersionId": null, "createdAt": "2026-09-21T02:03:00Z", "createdBy": "usr_owner", "creationMethod": "ai", "confirmedBy": "usr_owner", "confirmedAt": "2026-09-21T02:04:00Z", "items": [{ "id": "se_s1", "kind": "scriptElement", "ordinal": 1, "label": "门铃三响", "content": { "elementType": "sound" }, "provenance": [{ "type": "source_fragment", "sourceVersionId": "srcv_s1", "fragmentId": "frag_s1", "transformation": "sonified" }], "locked": false }] }] },
    { "stage": "settings", "activeVersionId": "cv_st1", "confirmedVersionId": "cv_st1", "versions": [{ "id": "cv_st1", "ordinal": 1, "status": "confirmed", "parentVersionId": null, "createdAt": "2026-09-21T02:05:00Z", "createdBy": "usr_owner", "creationMethod": "ai", "confirmedBy": "usr_owner", "confirmedAt": "2026-09-21T02:06:00Z", "items": [{ "id": "asset_s1", "kind": "settingAsset", "ordinal": 1, "label": "门口监控", "content": { "assetType": "prop" }, "provenance": [{ "type": "source_fragment", "sourceVersionId": "srcv_s1", "fragmentId": "frag_s1", "transformation": "retained" }], "locked": false }] }] },
    { "stage": "storyboard", "activeVersionId": "cv_sb1", "confirmedVersionId": "cv_sb1", "versions": [{ "id": "cv_sb1", "ordinal": 1, "status": "confirmed", "parentVersionId": null, "createdAt": "2026-09-21T02:07:00Z", "createdBy": "usr_owner", "creationMethod": "ai", "confirmedBy": "usr_owner", "confirmedAt": "2026-09-21T02:08:00Z", "items": [{ "id": "shot_s1", "kind": "shot", "ordinal": 1, "label": "空监控画面", "content": { "durationSeconds": 5 }, "provenance": [{ "type": "source_fragment", "sourceVersionId": "srcv_s1", "fragmentId": "frag_s1", "transformation": "visualized" }], "locked": false }] }] }
  ],
  "adaptationAdditions": [{ "id": "add_s1", "description": "监控时间码闪烁", "reason": "强化悬疑但不改变事实", "status": "approved", "proposedBy": "usr_owner", "proposedAt": "2026-09-21T02:03:00Z", "decidedBy": "usr_reviewer", "decidedAt": "2026-09-21T02:04:00Z" }],
  "impactLinks": [], "suggestions": [], "aiJobs": [{ "id": "job_s1", "stage": "storyboard", "status": "succeeded", "scopeKeys": ["shot:1"], "estimatedCredits": 2, "settledCredits": 2 }],
  "exportMetadata": { "generatedAt": "2026-09-21T02:09:00Z", "confirmationScope": "confirmed_only", "formats": ["json", "docx", "xlsx"] }
}
